product_name,supplier_name,unit_price,currency,sku,description
Dell Office Chair,Office Essentials Inc,18.44,USD,,Premium Office Chair with advanced features
Gamepad USB-C,Mega Electronics,264.84,USD,PROD-1970-A,
OEM USB Flash Drive Standard,BulkBuy Electronics,228.59,EUR,ITEM-9700-X,Reliable USB Flash Drive for business and home
LG USB Mouse Standard,Direct Import Co,217.76,USD,SKU-2747-PRO,Affordable USB Mouse with great performance
Lenovo Gamepad Bluetooth,Global Electronics Co,216.52,EUR,CAT-6601-X,Latest model Gamepad with warranty
Dell Gaming Monitor USB-C,Mega Electronics,190.28,USD,CAT-4147-PRO,Affordable Gaming Monitor with great performance
Acer Gaming Keyboard Elite,Digital Solutions,223.77,USD,ITEM-1578-B,Latest model Gaming Keyboard with warranty
Samsung USB-C Cable,BulkBuy Electronics,257.36,EUR,,Latest model USB-C Cable with warranty
Lenovo Monitor Privacy Screen Wireless,Asia Imports Ltd,126.96,USD,CAT-8194-B,
HP Cable Management Wired,Smart Supply Chain,19.32,USD,PROD-6808-B,Affordable Cable Management with great performance
Logitech Powerline Adapter USB-C,Smart Supply Chain,199.79,USD,ITEM-1510-PRO,High-quality Powerline Adapter for professional use
Microsoft External HDD Premium,BulkBuy Electronics,137.16,USD,SKU-4339-X,Professional-grade External HDD
Microsoft 32-inch Monitor Elite,Digital Solutions,61.47,USD,CAT-2654-A,High-quality 32-inch Monitor for professional use
Samsung Monitor Arm Wireless,Direct Import Co,68.04,EUR,,Reliable Monitor Arm for business and home
Generic Card Reader Plus,Wholesale Tech,259.75,USD,PROD-7257,Professional-grade Card Reader
Presentation Clicker Elite,Global Electronics Co,146.01,USD,PROD-4592-B,High-quality Presentation Clicker for professional use
Lenovo Graphics Tablet Wireless,Smart Supply Chain,275.06,USD,CAT-6506-B,
OEM Wi-Fi Router 2.4GHz,Global Electronics Co,72.79,USD,ITEM-5482-PRO,Latest model Wi-Fi Router with warranty
Samsung Numeric Keypad Premium,Tech Warehouse,18.66,USD,SKU-4428-B,Professional-grade Numeric Keypad
HP Drawing Pad Plus,Premium Tech Distributors,211.10,USD,ITEM-8938-X,Affordable Drawing Pad with great performance
HP Wireless Charger,Wholesale Tech,49.52,USD,ITEM-9632-X,Reliable Wireless Charger for business and home
Microsoft Office Chair Basic,Tech Warehouse,286.99,USD,PROD-6369-PRO,Premium Office Chair with advanced features
Logitech Network Switch Standard,Wholesale Tech,246.39,USD,ITEM-9596-B,
Acer Power Strip Wireless,Office Essentials Inc,153.79,EUR,ITEM-2468-X,Affordable Power Strip with great performance
Generic Bookshelf USB-C,Premium Tech Distributors,184.92,EUR,ITEM-4959-B,
Samsung 27-inch Monitor Plus,Premium Tech Distributors,274.02,EUR,SKU-7081-PRO,Affordable 27-inch Monitor with great performance
HP Graphics Tablet Bluetooth,Mega Electronics,204.34,USD,SKU-2399,Professional-grade Graphics Tablet
Dell Network Switch Plus,BulkBuy Electronics,81.42,EUR,CAT-2319-B,Premium Network Switch with advanced features
HP Desk Organizer,BulkBuy Electronics,71.57,USD,,Latest model Desk Organizer with warranty
Generic Micro USB Cable 2.4GHz,Digital Solutions,170.79,EUR,CAT-9577-A,High-quality Micro USB Cable for professional use
OEM Notebook RGB,Smart Supply Chain,270.09,EUR,PROD-8388,Affordable Notebook with great performance
Generic Ergonomic Keyboard RGB,Global Electronics Co,14.27,USD,ITEM-9335-A,High-quality Ergonomic Keyboard for professional use
Steering Wheel USB-C,Mega Electronics,193.14,USD,ITEM-6051-X,Professional-grade Steering Wheel
Acer 32-inch Monitor Wired,BulkBuy Electronics,120.99,USD,PROD-5367-X,Premium 32-inch Monitor with advanced features
Microsoft HDMI Cable Basic,TechPro Supplies,135.04,USD,SKU-3687-PRO,High-quality HDMI Cable for professional use
Logitech Monitor Arm,Tech Warehouse,264.46,USD,ITEM-9946-A,Affordable Monitor Arm with great performance
Lenovo Drawing Pad Wired,Wholesale Tech,290.58,USD,SKU-1725-PRO,Premium Drawing Pad with advanced features
Lenovo Desk Organizer 2.4GHz,Wholesale Tech,85.74,USD,CAT-6863-A,Professional-grade Desk Organizer
Lenovo HDMI Cable Basic,Global Electronics Co,79.79,USD,ITEM-2589-A,Professional-grade HDMI Cable
Lenovo Lightning Cable RGB,Direct Import Co,53.41,USD,PROD-1509-X,Premium Lightning Cable with advanced features
Dell Card Reader,Tech Warehouse,23.14,EUR,SKU-4018-X,Professional-grade Card Reader
Generic Monitor Riser Bluetooth,Smart Supply Chain,261.44,EUR,ITEM-6789-X,Professional-grade Monitor Riser
OEM 24-inch Monitor Plus,Wholesale Tech,106.11,USD,SKU-7353-B,High-quality 24-inch Monitor for professional use
Lenovo MicroSD Card Plus,Asia Imports Ltd,237.87,EUR,CAT-6221,Latest model MicroSD Card with warranty
Acer Card Reader Wired,Office Essentials Inc,95.08,EUR,CAT-5404,
Microsoft Docking Station RGB,Premium Tech Distributors,177.03,USD,PROD-3341,Professional-grade Docking Station
Generic 24-inch Monitor Bluetooth,Wholesale Tech,113.76,USD,PROD-2654-X,High-quality 24-inch Monitor for professional use
Drawing Pad 2.4GHz,Digital Solutions,126.51,USD,SKU-5406-A,Latest model Drawing Pad with warranty
Dell Steering Wheel Wired,Tech Warehouse,36.09,USD,SKU-9048-PRO,
Acer Ethernet Cable Wireless,Office Essentials Inc,283.58,EUR,ITEM-9749-B,
Logitech Pen Set Bluetooth,Global Electronics Co,208.34,EUR,PROD-6540,Professional-grade Pen Set
Acer USB Mouse Elite,Asia Imports Ltd,57.12,USD,ITEM-9583-A,Professional-grade USB Mouse
Microsoft HDMI to DisplayPort USB-C,BulkBuy Electronics,183.10,USD,ITEM-5838-X,High-quality HDMI to DisplayPort for professional use
Acer Wi-Fi Extender Premium,Global Electronics Co,219.32,USD,CAT-3484-X,Premium Wi-Fi Extender with advanced features
HP Filing Cabinet 2.4GHz,Digital Solutions,24.25,USD,CAT-4479-B,Latest model Filing Cabinet with warranty
HP Bookshelf Bluetooth,Smart Supply Chain,113.34,USD,,Latest model Bookshelf with warranty
Logitech Tablet Stand Standard,Asia Imports Ltd,53.67,USD,,Latest model Tablet Stand with warranty
Acer Cable Management Wired,Premium Tech Distributors,178.45,EUR,ITEM-3003-A,Professional-grade Cable Management
Generic Network Switch RGB,Office Essentials Inc,69.07,USD,PROD-9477-A,High-quality Network Switch for professional use
LG Pen Set Basic,Premium Tech Distributors,208.48,EUR,ITEM-4845-X,Premium Pen Set with advanced features
27-inch Monitor Wired,Mega Electronics,299.79,EUR,SKU-2254-A,Reliable 27-inch Monitor for business and home
HP Stylus Bluetooth,Mega Electronics,15.89,EUR,CAT-7043-PRO,Reliable Stylus for business and home
ASUS Monitor Arm,Mega Electronics,234.60,EUR,PROD-4065-X,Reliable Monitor Arm for business and home
Logitech Desk USB-C,Asia Imports Ltd,117.63,EUR,PROD-2116-PRO,High-quality Desk for professional use
Logitech Card Reader Bluetooth,BulkBuy Electronics,141.21,USD,ITEM-5262-X,
Generic Drawing Pad Wired,Global Electronics Co,239.30,USD,CAT-2469-X,Latest model Drawing Pad with warranty
Acer Bookshelf RGB,TechPro Supplies,71.96,EUR,SKU-8864-A,Reliable Bookshelf for business and home
OEM Trackball Mouse RGB,Digital Solutions,95.15,USD,ITEM-5355-B,
LG Network Card Basic,Asia Imports Ltd,59.93,USD,PROD-6140,
Generic Whiteboard Plus,Smart Supply Chain,255.07,EUR,PROD-8078-B,
Generic Speakers Wireless,BulkBuy Electronics,60.80,EUR,SKU-9173-A,
Samsung Ultrawide Monitor Standard,Tech Warehouse,215.38,USD,PROD-6913-A,Latest model Ultrawide Monitor with warranty
Microsoft Monitor Riser Basic,BulkBuy Electronics,163.85,USD,CAT-7362-B,Professional-grade Monitor Riser
Logitech SD Card Plus,BulkBuy Electronics,131.42,EUR,,Professional-grade SD Card
Acer Monitor Arm Wired,Tech Warehouse,158.82,USD,SKU-9030,
ASUS Powerline Adapter USB-C,TechPro Supplies,187.28,EUR,SKU-9825-B,High-quality Powerline Adapter for professional use
Acer External HDD Premium,Global Electronics Co,92.76,USD,SKU-2876-PRO,
Samsung Bookshelf Plus,Wholesale Tech,167.73,EUR,PROD-2192-A,Professional-grade Bookshelf
Lenovo Wireless Charger Bluetooth,Wholesale Tech,99.79,USD,ITEM-9437-X,Professional-grade Wireless Charger
Dell Graphics Tablet,Wholesale Tech,64.51,USD,,High-quality Graphics Tablet for professional use
Mesh Router Plus,Asia Imports Ltd,294.27,USD,CAT-4929,High-quality Mesh Router for professional use
OEM Ultrawide Monitor 2.4GHz,Wholesale Tech,151.32,EUR,CAT-1014-PRO,Reliable Ultrawide Monitor for business and home
Acer VGA Adapter Bluetooth,Premium Tech Distributors,245.84,EUR,ITEM-1249-A,Premium VGA Adapter with advanced features
Microsoft Monitor Riser Pro,BulkBuy Electronics,57.30,USD,SKU-3155-A,Affordable Monitor Riser with great performance
Bookshelf Premium,Asia Imports Ltd,180.17,USD,CAT-6190,Premium Bookshelf with advanced features
HP Network Switch Bluetooth,Global Electronics Co,28.66,USD,ITEM-9989-X,Reliable Network Switch for business and home
Samsung Card Reader Standard,Mega Electronics,148.16,EUR,PROD-2216-PRO,Professional-grade Card Reader
Acer Ergonomic Mouse Standard,TechPro Supplies,265.65,USD,SKU-8431-PRO,Reliable Ergonomic Mouse for business and home
Generic Portable SSD USB-C,BulkBuy Electronics,170.54,USD,PROD-8466-A,Affordable Portable SSD with great performance
Lenovo Speakers USB-C,Wholesale Tech,203.34,USD,SKU-1761-A,Professional-grade Speakers
Dell Ethernet Cable USB-C,Asia Imports Ltd,99.85,EUR,CAT-2511-A,High-quality Ethernet Cable for professional use
Dell Stylus Basic,Tech Warehouse,204.35,EUR,SKU-8015-PRO,Latest model Stylus with warranty
USB-A to USB-C Adapter Basic,Digital Solutions,137.74,USD,SKU-2748-PRO,
Acer Phone Charger 2.4GHz,TechPro Supplies,45.42,USD,ITEM-7925-A,Affordable Phone Charger with great performance
Stylus RGB,Office Essentials Inc,163.04,EUR,,Latest model Stylus with warranty
Samsung Steering Wheel Wired,Direct Import Co,109.63,USD,SKU-5478-PRO,Professional-grade Steering Wheel
Generic Surge Protector 2.4GHz,Global Electronics Co,262.30,USD,SKU-4000-B,Affordable Surge Protector with great performance
Generic Laptop Charger RGB,TechPro Supplies,101.51,USD,PROD-3724-PRO,
ASUS Numeric Keypad Wireless,Premium Tech Distributors,158.90,USD,ITEM-7779,Premium Numeric Keypad with advanced features
Lenovo DisplayPort Cable Wireless,Tech Warehouse,147.40,USD,SKU-3790-PRO,Premium DisplayPort Cable with advanced features
OEM 4K Monitor USB-C,Smart Supply Chain,18.12,EUR,SKU-6544,
Audio Cable,Global Electronics Co,69.34,USD,,Latest model Audio Cable with warranty
ASUS Gamepad Elite,BulkBuy Electronics,13.01,USD,CAT-8002-A,Reliable Gamepad for business and home
Microsoft Ethernet Cable Pro,Smart Supply Chain,159.43,USD,SKU-9646-B,
Generic Ultrawide Monitor Elite,Smart Supply Chain,211.11,EUR,ITEM-2616-PRO,Premium Ultrawide Monitor with advanced features
Dell Lightning Cable Elite,Premium Tech Distributors,287.24,EUR,PROD-4845-B,
Dell Mesh Router Wireless,Smart Supply Chain,148.30,USD,CAT-4158-PRO,Premium Mesh Router with advanced features
Generic Presentation Clicker Elite,Mega Electronics,69.47,USD,CAT-6104,
Samsung Microphone Standard,Mega Electronics,209.64,EUR,ITEM-5614-B,High-quality Microphone for professional use
HP Portable Monitor 2.4GHz,Smart Supply Chain,240.00,USD,PROD-8555-X,
Logitech MicroSD Card Pro,Smart Supply Chain,49.94,USD,CAT-4022-B,Reliable MicroSD Card for business and home
Microsoft Portable SSD Premium,Global Electronics Co,274.67,USD,PROD-8747-A,Premium Portable SSD with advanced features
HP Ethernet Cable Pro,TechPro Supplies,148.55,EUR,ITEM-6093,Professional-grade Ethernet Cable
Acer DisplayPort Cable Basic,Global Electronics Co,252.12,EUR,SKU-2007-X,Premium DisplayPort Cable with advanced features
HP SD Card RGB,Wholesale Tech,260.96,EUR,SKU-4550,High-quality SD Card for professional use
ASUS Bookshelf Premium,Mega Electronics,203.78,USD,ITEM-6909-X,High-quality Bookshelf for professional use
Samsung Monitor Arm Wired,Wholesale Tech,168.69,USD,ITEM-2703-A,Latest model Monitor Arm with warranty
Microsoft USB Charger Plus,Mega Electronics,132.22,USD,ITEM-8535-B,
OEM USB Flash Drive Pro,TechPro Supplies,40.37,EUR,CAT-1173-X,Affordable USB Flash Drive with great performance
Trackball Mouse USB-C,Global Electronics Co,54.14,EUR,SKU-4879-X,
Microsoft Pen Set Wireless,Office Essentials Inc,286.47,USD,SKU-7073,High-quality Pen Set for professional use
Dell 32-inch Monitor Basic,Tech Warehouse,237.49,EUR,CAT-1713-B,Latest model 32-inch Monitor with warranty
Dell Office Chair Elite,Premium Tech Distributors,97.10,USD,ITEM-1292,Premium Office Chair with advanced features
Lenovo USB Charger,Digital Solutions,278.04,USD,ITEM-3015-A,Premium USB Charger with advanced features
HP Portable SSD Pro,Direct Import Co,28.27,EUR,CAT-2522-B,
Lenovo Modem Elite,Digital Solutions,237.69,USD,ITEM-1500-B,
Logitech Network Card USB-C,Mega Electronics,166.31,USD,,Affordable Network Card with great performance
Acer Webcam 2.4GHz,Direct Import Co,219.66,USD,SKU-7244-X,
NAS Drive Wired,Wholesale Tech,265.85,USD,PROD-4836-PRO,Latest model NAS Drive with warranty
ASUS External SSD Wireless,TechPro Supplies,283.50,USD,ITEM-5957-PRO,High-quality External SSD for professional use
Microsoft Stylus Premium,Global Electronics Co,69.04,USD,ITEM-6875-B,
Dell External SSD Bluetooth,Direct Import Co,221.73,EUR,ITEM-3630-A,Reliable External SSD for business and home
ASUS Graphics Tablet Wireless,BulkBuy Electronics,270.84,EUR,PROD-5989-PRO,
OEM Filing Cabinet Standard,Wholesale Tech,57.46,USD,CAT-5529,Reliable Filing Cabinet for business and home
LG Wireless Charger RGB,Direct Import Co,50.69,USD,PROD-3390-X,Latest model Wireless Charger with warranty
ASUS USB-A to USB-C Adapter Elite,Office Essentials Inc,131.23,USD,PROD-6964,Premium USB-A to USB-C Adapter with advanced features
Dell USB Hub Pro,Global Electronics Co,49.41,EUR,CAT-6670-PRO,Reliable USB Hub for business and home
LG Presentation Clicker Bluetooth,Wholesale Tech,277.29,USD,,High-quality Presentation Clicker for professional use
OEM Ethernet Cable Elite,TechPro Supplies,258.57,USD,CAT-6541,
LG Power Strip RGB,Asia Imports Ltd,35.70,USD,PROD-2005-PRO,Affordable Power Strip with great performance
Lenovo Monitor Riser Bluetooth,Asia Imports Ltd,50.01,USD,PROD-1020,High-quality Monitor Riser for professional use
Microsoft HDMI to DisplayPort RGB,Mega Electronics,200.65,EUR,CAT-9781-X,Professional-grade HDMI to DisplayPort
Pen Set Elite,Asia Imports Ltd,298.97,EUR,ITEM-9010-B,Latest model Pen Set with warranty
Acer Card Reader Standard,TechPro Supplies,214.53,USD,,Premium Card Reader with advanced features
USB Flash Drive USB-C,BulkBuy Electronics,195.52,EUR,CAT-6798-A,Premium USB Flash Drive with advanced features
HP Wi-Fi Extender Elite,TechPro Supplies,105.75,EUR,CAT-6154-X,High-quality Wi-Fi Extender for professional use
USB-C Cable RGB,Global Electronics Co,16.42,USD,SKU-2787-A,Premium USB-C Cable with advanced features
Acer Monitor Riser Standard,Tech Warehouse,191.04,USD,ITEM-1337-A,Premium Monitor Riser with advanced features
HP SD Card USB-C,Tech Warehouse,202.85,USD,ITEM-6313-PRO,Premium SD Card with advanced features
HP MicroSD Card Premium,BulkBuy Electronics,84.56,USD,,Reliable MicroSD Card for business and home
Lenovo USB-A to USB-C Adapter 2.4GHz,Digital Solutions,265.58,USD,SKU-7696-A,High-quality USB-A to USB-C Adapter for professional use
Samsung Mechanical Keyboard Bluetooth,Mega Electronics,193.09,USD,,Latest model Mechanical Keyboard with warranty
Acer Powerline Adapter Plus,Office Essentials Inc,58.70,EUR,PROD-6206-A,
Acer External HDD RGB,Premium Tech Distributors,114.02,USD,PROD-9008-B,Latest model External HDD with warranty
Generic Stylus Premium,BulkBuy Electronics,290.84,USD,SKU-5496,High-quality Stylus for professional use
Generic 4K Monitor RGB,Premium Tech Distributors,128.69,USD,ITEM-2115-B,
Dell Network Card Pro,TechPro Supplies,275.88,USD,ITEM-3667-X,Affordable Network Card with great performance
Microsoft Office Chair Standard,Digital Solutions,28.82,USD,,Reliable Office Chair for business and home
OEM Powerline Adapter Pro,Wholesale Tech,190.02,USD,CAT-3881-X,Premium Powerline Adapter with advanced features
Lenovo Phone Charger Wireless,TechPro Supplies,173.16,USD,PROD-2716,
HP USB Flash Drive Bluetooth,Smart Supply Chain,271.89,USD,PROD-1910-X,Premium USB Flash Drive with advanced features
Microsoft Gaming Mouse RGB,Premium Tech Distributors,186.87,EUR,CAT-7089-B,Latest model Gaming Mouse with warranty
Lenovo Steering Wheel Elite,Premium Tech Distributors,59.42,USD,SKU-4287,Affordable Steering Wheel with great performance
USB Flash Drive RGB,Digital Solutions,87.33,EUR,ITEM-2211-A,Affordable USB Flash Drive with great performance
LG Wi-Fi Router Standard,Asia Imports Ltd,252.88,USD,ITEM-8774-B,Reliable Wi-Fi Router for business and home
Generic Network Switch Standard,Mega Electronics,170.15,USD,SKU-4067-X,
OEM Docking Station Bluetooth,TechPro Supplies,148.52,USD,ITEM-6459-X,High-quality Docking Station for professional use
LG HDMI Cable 2.4GHz,Tech Warehouse,203.58,USD,ITEM-6523-PRO,High-quality HDMI Cable for professional use
Generic Micro USB Cable RGB,Global Electronics Co,210.16,EUR,CAT-6700-A,Latest model Micro USB Cable with warranty
Generic USB-A to USB-C Adapter Premium,Wholesale Tech,47.42,EUR,CAT-9136-X,High-quality USB-A to USB-C Adapter for professional use
Lenovo External SSD Basic,Smart Supply Chain,276.26,USD,PROD-6967,Professional-grade External SSD
Microsoft Portable Monitor Wired,Smart Supply Chain,184.67,USD,CAT-1251-B,Reliable Portable Monitor for business and home
Logitech Phone Charger Basic,Smart Supply Chain,241.67,USD,PROD-7354-A,Affordable Phone Charger with great performance
Logitech Card Reader Bluetooth,Tech Warehouse,195.84,EUR,PROD-1140-A,Premium Card Reader with advanced features
HP Bookshelf Wireless,Smart Supply Chain,220.61,EUR,,
OEM Bookshelf USB-C,Mega Electronics,289.70,USD,SKU-7367-X,Reliable Bookshelf for business and home
Monitor Privacy Screen Plus,Digital Solutions,59.63,USD,PROD-1302-B,High-quality Monitor Privacy Screen for professional use
Dell Surge Protector Pro,Office Essentials Inc,286.26,USD,SKU-6236-X,Premium Surge Protector with advanced features
Microsoft Bookshelf Elite,Wholesale Tech,42.49,EUR,PROD-7799-A,Professional-grade Bookshelf
HP Card Reader 2.4GHz,Mega Electronics,102.40,USD,ITEM-1255-PRO,Reliable Card Reader for business and home
Powerline Adapter Bluetooth,BulkBuy Electronics,227.72,EUR,SKU-5717-PRO,
Wi-Fi Extender Wireless,BulkBuy Electronics,165.82,USD,SKU-5955-PRO,Latest model Wi-Fi Extender with warranty
LG Ultrawide Monitor 2.4GHz,Office Essentials Inc,278.18,USD,PROD-5942-A,Reliable Ultrawide Monitor for business and home
Acer Gaming Monitor Pro,Office Essentials Inc,101.29,USD,PROD-1256-B,Affordable Gaming Monitor with great performance
Lenovo Graphics Tablet USB-C,Mega Electronics,251.35,USD,ITEM-9182-PRO,Reliable Graphics Tablet for business and home
ASUS Graphics Tablet Plus,BulkBuy Electronics,274.86,USD,PROD-2408-B,Professional-grade Graphics Tablet
Generic USB Flash Drive Wireless,Office Essentials Inc,125.53,EUR,PROD-6215-PRO,Professional-grade USB Flash Drive
Dell Joystick Premium,Digital Solutions,290.32,USD,ITEM-4310-A,Premium Joystick with advanced features
Joystick Basic,Asia Imports Ltd,109.82,EUR,SKU-6913,Premium Joystick with advanced features
Numeric Keypad Pro,Office Essentials Inc,85.51,USD,PROD-2005-A,Affordable Numeric Keypad with great performance
LG Audio Cable Standard,Premium Tech Distributors,229.76,USD,ITEM-4381-X,
OEM Laptop Charger Elite,TechPro Supplies,285.79,USD,,
Dell Power Bank Wireless,Tech Warehouse,104.81,USD,ITEM-4160-A,Affordable Power Bank with great performance
Dell Micro USB Cable,Digital Solutions,195.93,USD,PROD-7116-X,Affordable Micro USB Cable with great performance
Lenovo Network Switch Elite,Smart Supply Chain,237.13,EUR,,Premium Network Switch with advanced features
Microsoft Steering Wheel Premium,Wholesale Tech,176.56,USD,SKU-5310,Premium Steering Wheel with advanced features
Acer Tablet Stand Pro,Office Essentials Inc,273.96,USD,CAT-7094-X,Reliable Tablet Stand for business and home
HP 4K Monitor RGB,Direct Import Co,224.36,USD,SKU-6046-B,Affordable 4K Monitor with great performance
OEM Lightning Cable Bluetooth,Wholesale Tech,254.15,USD,CAT-9452-A,Latest model Lightning Cable with warranty
OEM NAS Drive Wireless,TechPro Supplies,164.15,EUR,ITEM-1260-A,
Generic Tablet Stand,BulkBuy Electronics,180.96,USD,ITEM-6825-X,Reliable Tablet Stand for business and home
OEM Card Reader Pro,Mega Electronics,68.93,USD,SKU-7616-X,
Samsung Desk Organizer Wireless,Global Electronics Co,157.97,USD,PROD-7319,Premium Desk Organizer with advanced features
HP Stylus Wired,Direct Import Co,105.93,USD,ITEM-4119-PRO,High-quality Stylus for professional use
Samsung Joystick Wireless,BulkBuy Electronics,143.61,USD,ITEM-1537-B,Latest model Joystick with warranty
Dell UPS Battery Backup Pro,Premium Tech Distributors,113.00,USD,SKU-3519,Affordable UPS Battery Backup with great performance
Acer Portable Monitor,Wholesale Tech,47.96,USD,PROD-1977,High-quality Portable Monitor for professional use
Generic Joystick 2.4GHz,Office Essentials Inc,141.83,USD,CAT-5473-PRO,Affordable Joystick with great performance
OEM DisplayPort Cable Elite,Digital Solutions,281.80,USD,CAT-6911-B,
OEM Network Switch Basic,Smart Supply Chain,175.15,USD,CAT-1170-PRO,Reliable Network Switch for business and home
Lenovo Monitor Riser 2.4GHz,Wholesale Tech,261.53,EUR,PROD-6097-A,Affordable Monitor Riser with great performance
HP Drawing Pad RGB,Global Electronics Co,72.02,USD,CAT-4878-A,
Dell HDMI to DisplayPort,BulkBuy Electronics,176.83,USD,CAT-1999-A,Latest model HDMI to DisplayPort with warranty
Samsung Office Chair RGB,Global Electronics Co,232.95,USD,SKU-4284-X,Reliable Office Chair for business and home
OEM Power Bank Pro,Global Electronics Co,207.88,USD,ITEM-1921-A,Premium Power Bank with advanced features
ASUS Numeric Keypad Wired,TechPro Supplies,42.85,EUR,ITEM-1339-X,Reliable Numeric Keypad for business and home
Generic Ultrawide Monitor RGB,Global Electronics Co,221.25,USD,SKU-5358-B,Premium Ultrawide Monitor with advanced features
Samsung Network Card Wireless,Office Essentials Inc,70.29,USD,PROD-5582-A,Reliable Network Card for business and home
Dell USB Hub Elite,Wholesale Tech,44.53,EUR,CAT-2717-PRO,
ASUS VGA Adapter USB-C,Smart Supply Chain,208.79,USD,ITEM-4563-B,Premium VGA Adapter with advanced features
Dell Network Card Wireless,Wholesale Tech,184.14,USD,ITEM-7310-A,
Acer Laptop Charger Pro,Wholesale Tech,96.94,USD,PROD-1553-PRO,Latest model Laptop Charger with warranty
ASUS Network Switch Basic,BulkBuy Electronics,275.30,EUR,PROD-5183,
Generic Ethernet Cable USB-C,Tech Warehouse,240.74,USD,SKU-8387-X,Premium Ethernet Cable with advanced features
HP Whiteboard USB-C,Smart Supply Chain,291.96,USD,SKU-8589-X,Premium Whiteboard with advanced features
HP Monitor Privacy Screen Pro,Premium Tech Distributors,226.77,USD,CAT-2315-A,Premium Monitor Privacy Screen with advanced features
ASUS Gamepad Elite,Asia Imports Ltd,177.82,EUR,CAT-5248-B,Professional-grade Gamepad
USB-C Cable 2.4GHz,Asia Imports Ltd,274.26,USD,ITEM-5340-X,
Microsoft DisplayPort Cable Elite,Office Essentials Inc,205.58,USD,PROD-5720-PRO,Latest model DisplayPort Cable with warranty
HP Portable SSD Standard,Direct Import Co,117.81,USD,CAT-2679-X,Premium Portable SSD with advanced features
Acer Monitor Riser Plus,Smart Supply Chain,49.65,USD,ITEM-6698-X,Premium Monitor Riser with advanced features
Generic Power Bank Bluetooth,Mega Electronics,42.64,USD,SKU-1003-X,
Microsoft Headset Elite,Premium Tech Distributors,132.52,EUR,PROD-9407-X,Reliable Headset for business and home
Lenovo Network Card 2.4GHz,Wholesale Tech,79.66,USD,PROD-8160-A,Reliable Network Card for business and home
Office Chair Basic,Premium Tech Distributors,205.92,EUR,ITEM-5106-PRO,
LG Wireless Mouse RGB,Wholesale Tech,186.36,EUR,SKU-3685-A,
ASUS USB-C Hub Wireless,Mega Electronics,50.64,USD,CAT-1534-PRO,Reliable USB-C Hub for business and home
OEM Docking Station,Global Electronics Co,81.76,USD,PROD-5259-A,Premium Docking Station with advanced features
Ultrawide Monitor Standard,Tech Warehouse,248.91,USD,ITEM-6780,
Generic Ultrawide Monitor Basic,Tech Warehouse,33.98,USD,CAT-3916,Reliable Ultrawide Monitor for business and home
Acer Monitor Stand Pro,Asia Imports Ltd,22.67,USD,ITEM-6071-B,Reliable Monitor Stand for business and home
HP Whiteboard Wired,Mega Electronics,236.04,USD,ITEM-4751-X,Latest model Whiteboard with warranty
LG Desk Lamp Pro,Wholesale Tech,126.27,USD,SKU-1776-X,High-quality Desk Lamp for professional use
Microsoft NAS Drive Standard,Tech Warehouse,233.43,USD,CAT-4106-A,High-quality NAS Drive for professional use
Microsoft SD Card Bluetooth,Asia Imports Ltd,192.32,EUR,CAT-7738-A,Latest model SD Card with warranty
Generic Ethernet Cable Pro,Wholesale Tech,228.59,USD,PROD-4011-A,Latest model Ethernet Cable with warranty
Whiteboard RGB,Digital Solutions,173.08,EUR,PROD-3274-X,Latest model Whiteboard with warranty
Generic Bookshelf Plus,BulkBuy Electronics,92.01,USD,PROD-3534-B,Premium Bookshelf with advanced features
Generic VGA Adapter Bluetooth,Premium Tech Distributors,76.82,USD,,Premium VGA Adapter with advanced features
ASUS Gamepad Wired,Premium Tech Distributors,207.40,EUR,SKU-2637-PRO,High-quality Gamepad for professional use
OEM External HDD Pro,Wholesale Tech,200.56,USD,SKU-2619-PRO,Reliable External HDD for business and home
ASUS 27-inch Monitor Plus,TechPro Supplies,226.75,USD,,Latest model 27-inch Monitor with warranty
ASUS Drawing Pad Wired,Asia Imports Ltd,20.07,EUR,SKU-9042-A,Latest model Drawing Pad with warranty
Microsoft Network Card Wireless,Global Electronics Co,248.98,USD,PROD-5143,
HP Laptop Charger Bluetooth,Direct Import Co,225.19,USD,ITEM-5707-PRO,Reliable Laptop Charger for business and home
ASUS Card Reader Plus,Tech Warehouse,181.81,USD,CAT-4488-PRO,
ASUS Network Card Standard,Digital Solutions,151.18,USD,PROD-8799-PRO,High-quality Network Card for professional use
Dell Card Reader Basic,Global Electronics Co,214.36,USD,,
