product_name,supplier_name,unit_price,currency,sku,description
Samsung Tablet Stand 2.4GHz,BulkBuy Electronics,294.09,USD,ITEM-2962,Latest model Tablet Stand with warranty
Dell Ethernet Cable Pro,TechPro Supplies,113.09,EUR,ITEM-4429-B,Premium Ethernet Cable with advanced features
Whiteboard Plus,TechPro Supplies,157.30,USD,CAT-6039-A,Premium Whiteboard with advanced features
OEM Monitor Privacy Screen Bluetooth,TechPro Supplies,235.48,USD,SKU-6737,Affordable Monitor Privacy Screen with great performance
Generic Monitor Arm Pro,Mega Electronics,154.68,EUR,SKU-8867-PRO,Premium Monitor Arm with advanced features
Lenovo DisplayPort Cable Wired,TechPro Supplies,199.72,USD,SKU-7868-B,Affordable DisplayPort Cable with great performance
Microsoft SD Card Basic,Tech Warehouse,155.60,USD,,
Acer Filing Cabinet Plus,BulkBuy Electronics,133.18,USD,CAT-1159-X,High-quality Filing Cabinet for professional use
HP 32-inch Monitor USB-C,Mega Electronics,70.87,USD,SKU-7950-A,Professional-grade 32-inch Monitor
Cable Management Standard,Mega Electronics,296.31,USD,PROD-9559-A,Affordable Cable Management with great performance
Desk,Premium Tech Distributors,220.14,USD,SKU-3981-B,Premium Desk with advanced features
Acer USB-C Hub Elite,Direct Import Co,272.52,USD,,Latest model USB-C Hub with warranty
Audio Cable Wireless,Asia Imports Ltd,95.73,USD,SKU-2884-A,Affordable Audio Cable with great performance
LG VGA Adapter Bluetooth,Smart Supply Chain,245.83,EUR,PROD-5596-X,High-quality VGA Adapter for professional use
ASUS VGA Adapter Elite,Wholesale Tech,276.59,USD,CAT-1332,Premium VGA Adapter with advanced features
Logitech Phone Charger,Mega Electronics,23.92,USD,SKU-1190-B,Latest model Phone Charger with warranty
Generic Graphics Tablet Wireless,BulkBuy Electronics,87.19,USD,ITEM-7964,Professional-grade Graphics Tablet
Logitech Audio Cable Premium,Asia Imports Ltd,167.90,EUR,PROD-3183-X,Professional-grade Audio Cable
Acer Micro USB Cable Wired,Direct Import Co,161.60,EUR,CAT-2563-A,Professional-grade Micro USB Cable
HP Wi-Fi Router 2.4GHz,Global Electronics Co,92.30,USD,PROD-6552-PRO,High-quality Wi-Fi Router for professional use
HP SD Card Standard,Office Essentials Inc,170.62,USD,SKU-7226-PRO,High-quality SD Card for professional use
ASUS Joystick Elite,Wholesale Tech,244.63,USD,PROD-2255,Reliable Joystick for business and home
Generic Card Reader RGB,Mega Electronics,274.67,USD,,
Lenovo Desk Lamp,Digital Solutions,210.35,USD,,Latest model Desk Lamp with warranty
Generic SD Card Wired,Tech Warehouse,264.27,USD,CAT-7681,
LG Surge Protector,Tech Warehouse,49.04,USD,CAT-2523,Reliable Surge Protector for business and home
LG Ethernet Cable RGB,Direct Import Co,292.86,USD,ITEM-4679-X,Affordable Ethernet Cable with great performance
HP Ergonomic Keyboard Elite,BulkBuy Electronics,150.93,USD,PROD-5650-X,Professional-grade Ergonomic Keyboard
Ultrawide Monitor Wired,Wholesale Tech,281.20,USD,CAT-6843-A,Professional-grade Ultrawide Monitor
Microsoft Modem Wireless,Wholesale Tech,23.25,USD,SKU-9030-PRO,Premium Modem with advanced features
HP 24-inch Monitor Wired,TechPro Supplies,166.88,USD,ITEM-7086-PRO,High-quality 24-inch Monitor for professional use
Samsung Ethernet Cable Standard,BulkBuy Electronics,255.07,EUR,SKU-8568-B,High-quality Ethernet Cable for professional use
External HDD Wired,TechPro Supplies,148.40,EUR,ITEM-3217-B,Premium External HDD with advanced features
Microsoft Bookshelf Standard,Wholesale Tech,76.16,USD,PROD-3132-PRO,Premium Bookshelf with advanced features
Samsung 4K Monitor Wired,Global Electronics Co,288.02,USD,ITEM-6095-X,
HP Wireless Keyboard RGB,Premium Tech Distributors,110.39,USD,SKU-2611-X,Premium Wireless Keyboard with advanced features
Power Bank Standard,Mega Electronics,250.67,USD,ITEM-7998,
Microsoft SD Card Pro,Asia Imports Ltd,85.18,EUR,SKU-1243-X,Latest model SD Card with warranty
HP Laptop Charger Pro,Wholesale Tech,256.21,USD,CAT-8975-A,Premium Laptop Charger with advanced features
Generic Wi-Fi Extender Premium,BulkBuy Electronics,197.73,EUR,PROD-1760,Reliable Wi-Fi Extender for business and home
Microsoft Card Reader 2.4GHz,Smart Supply Chain,123.20,USD,,Reliable Card Reader for business and home
Samsung HDMI to DisplayPort Bluetooth,Direct Import Co,182.33,EUR,,Reliable HDMI to DisplayPort for business and home
ASUS Modem Bluetooth,Digital Solutions,276.93,USD,,Reliable Modem for business and home
Lenovo Phone Charger 2.4GHz,TechPro Supplies,218.32,USD,ITEM-8462,
Logitech Wireless Charger Premium,Mega Electronics,148.67,USD,ITEM-4062,Professional-grade Wireless Charger
Lenovo Card Reader 2.4GHz,Office Essentials Inc,232.77,USD,ITEM-7648-A,
Network Switch Basic,Digital Solutions,62.47,EUR,,
Logitech Phone Stand Plus,Global Electronics Co,272.85,USD,ITEM-6405-B,Latest model Phone Stand with warranty
LG Audio Cable RGB,Wholesale Tech,223.39,USD,ITEM-6902-A,Affordable Audio Cable with great performance
Logitech SD Card Basic,BulkBuy Electronics,281.09,EUR,PROD-2301,High-quality SD Card for professional use
Logitech NAS Drive Plus,Global Electronics Co,193.75,USD,SKU-1160-X,High-quality NAS Drive for professional use
Dell Mechanical Keyboard USB-C,Premium Tech Distributors,95.46,USD,ITEM-1093-X,Premium Mechanical Keyboard with advanced features
OEM Modem Wireless,BulkBuy Electronics,201.09,EUR,PROD-6359-X,Affordable Modem with great performance
Acer Stylus USB-C,Digital Solutions,219.09,EUR,PROD-4654-B,
HP Headset Bluetooth,Mega Electronics,249.89,USD,CAT-2113,High-quality Headset for professional use
LG Wi-Fi Router Pro,Direct Import Co,37.00,USD,ITEM-7866-X,Professional-grade Wi-Fi Router
Dell MicroSD Card Bluetooth,Asia Imports Ltd,205.55,EUR,ITEM-6323-B,Latest model MicroSD Card with warranty
HP Bookshelf 2.4GHz,BulkBuy Electronics,272.87,USD,CAT-9727-PRO,Premium Bookshelf with advanced features
Generic Ultrawide Monitor 2.4GHz,Digital Solutions,68.66,USD,SKU-2462-PRO,Latest model Ultrawide Monitor with warranty
HP DisplayPort Cable Elite,Smart Supply Chain,196.30,USD,ITEM-5603-X,
HP SD Card Bluetooth,Office Essentials Inc,200.99,USD,ITEM-1854-A,Latest model SD Card with warranty
Microsoft Gaming Mouse RGB,Tech Warehouse,271.39,USD,SKU-1283-B,Reliable Gaming Mouse for business and home
Samsung Monitor Stand Premium,Global Electronics Co,84.61,EUR,SKU-6518-B,Premium Monitor Stand with advanced features
Lenovo Monitor Riser Standard,Premium Tech Distributors,88.24,USD,PROD-6482-X,Affordable Monitor Riser with great performance
Samsung Card Reader Plus,Wholesale Tech,203.71,USD,SKU-1244-X,Premium Card Reader with advanced features
HP Surge Protector Wired,Asia Imports Ltd,134.96,USD,PROD-2081-X,Professional-grade Surge Protector
Samsung Presentation Clicker Basic,Global Electronics Co,153.65,USD,CAT-5665-A,High-quality Presentation Clicker for professional use
Acer Steering Wheel RGB,Global Electronics Co,191.79,USD,ITEM-2741,Affordable Steering Wheel with great performance
ASUS Power Bank Wired,Direct Import Co,210.83,EUR,SKU-1318,Premium Power Bank with advanced features
Pen Set Pro,Digital Solutions,265.90,USD,ITEM-8577-A,Latest model Pen Set with warranty
Logitech Desk Organizer Plus,Direct Import Co,93.62,EUR,SKU-9794-PRO,Premium Desk Organizer with advanced features
Whiteboard Wired,Asia Imports Ltd,188.78,USD,SKU-5934-X,High-quality Whiteboard for professional use
Acer Joystick 2.4GHz,Direct Import Co,141.86,EUR,CAT-5750-X,Latest model Joystick with warranty
Microsoft Wi-Fi Router Plus,Digital Solutions,19.97,USD,PROD-2328-B,Latest model Wi-Fi Router with warranty
Microsoft SD Card 2.4GHz,Wholesale Tech,230.82,USD,,High-quality SD Card for professional use
Samsung Desk Organizer Pro,Direct Import Co,113.43,EUR,SKU-5868-B,Latest model Desk Organizer with warranty
LG Mesh Router,Digital Solutions,37.59,USD,ITEM-7222-X,Premium Mesh Router with advanced features
OEM USB Charger Premium,Asia Imports Ltd,68.55,USD,ITEM-5022-A,Affordable USB Charger with great performance
Logitech Mesh Router Bluetooth,Tech Warehouse,203.49,USD,CAT-9114-B,Affordable Mesh Router with great performance
Laptop Charger RGB,Global Electronics Co,38.02,USD,ITEM-5605-B,Latest model Laptop Charger with warranty
Samsung Wireless Keyboard Pro,Digital Solutions,135.76,USD,PROD-1798-A,Premium Wireless Keyboard with advanced features
Logitech Laptop Charger Bluetooth,Smart Supply Chain,247.60,USD,ITEM-2608-A,
ASUS Phone Stand,Premium Tech Distributors,42.64,USD,SKU-8478-PRO,Reliable Phone Stand for business and home
LG Numeric Keypad Basic,Office Essentials Inc,164.12,USD,PROD-9663,Professional-grade Numeric Keypad
Logitech Lightning Cable Plus,Mega Electronics,11.02,USD,ITEM-9692-PRO,Premium Lightning Cable with advanced features
ASUS Audio Cable Standard,Smart Supply Chain,112.52,USD,SKU-1549-PRO,Latest model Audio Cable with warranty
LG Network Card Elite,Asia Imports Ltd,193.75,EUR,ITEM-8988,Latest model Network Card with warranty
Acer Surge Protector USB-C,Mega Electronics,292.28,USD,PROD-4335,High-quality Surge Protector for professional use
Acer Laptop Charger Elite,Global Electronics Co,103.74,USD,SKU-2916-B,Professional-grade Laptop Charger
OEM USB Hub,Global Electronics Co,83.96,USD,PROD-8488-PRO,Latest model USB Hub with warranty
Lightning Cable Basic,Direct Import Co,56.24,USD,CAT-7708-PRO,Reliable Lightning Cable for business and home
Dell Office Chair Standard,Direct Import Co,168.12,USD,,Premium Office Chair with advanced features
ASUS Graphics Tablet Premium,Mega Electronics,22.47,USD,SKU-2852-PRO,High-quality Graphics Tablet for professional use
OEM 24-inch Monitor,Mega Electronics,200.07,USD,PROD-4261-X,Affordable 24-inch Monitor with great performance
OEM Power Strip Wired,Global Electronics Co,261.48,USD,ITEM-9914-PRO,
Samsung Stylus Wired,Asia Imports Ltd,243.60,USD,,
Generic Portable Monitor 2.4GHz,Global Electronics Co,55.27,USD,CAT-2338-A,
Acer Wi-Fi Router USB-C,Tech Warehouse,67.67,USD,ITEM-3100-B,High-quality Wi-Fi Router for professional use
Microsoft Monitor Stand Bluetooth,Tech Warehouse,229.97,USD,PROD-8181-X,Premium Monitor Stand with advanced features
Samsung Power Strip Elite,Wholesale Tech,270.50,EUR,CAT-2555-X,Affordable Power Strip with great performance
HP Phone Charger Basic,Office Essentials Inc,269.97,USD,SKU-3461-PRO,Latest model Phone Charger with warranty
OEM Stylus Basic,Mega Electronics,22.45,USD,SKU-4330-A,Reliable Stylus for business and home
OEM Cable Management Elite,Asia Imports Ltd,248.55,USD,ITEM-9943-PRO,Reliable Cable Management for business and home
Acer Gamepad Elite,Digital Solutions,138.87,USD,ITEM-8671-X,
OEM Ethernet Cable Wired,Wholesale Tech,255.88,USD,CAT-1633-PRO,Premium Ethernet Cable with advanced features
Logitech Desk Elite,Direct Import Co,51.57,USD,SKU-9447-A,Latest model Desk with warranty
LG 24-inch Monitor Bluetooth,Digital Solutions,105.10,USD,CAT-2317-X,Affordable 24-inch Monitor with great performance
Microsoft Mechanical Keyboard Plus,BulkBuy Electronics,203.58,USD,SKU-5388,Reliable Mechanical Keyboard for business and home
OEM Network Card Bluetooth,Asia Imports Ltd,49.67,USD,ITEM-4395,Latest model Network Card with warranty
Generic Whiteboard Bluetooth,Office Essentials Inc,22.56,EUR,,Latest model Whiteboard with warranty
ASUS USB-C Cable Elite,Mega Electronics,48.98,USD,PROD-1295-PRO,
HP Desk Organizer Bluetooth,TechPro Supplies,72.44,USD,CAT-3772,High-quality Desk Organizer for professional use
LG DisplayPort Cable Plus,Smart Supply Chain,285.95,EUR,SKU-3432-B,High-quality DisplayPort Cable for professional use
Dell SD Card Basic,Tech Warehouse,20.97,USD,SKU-3647-X,Professional-grade SD Card
Dell Card Reader Wired,Digital Solutions,224.23,USD,CAT-1866-A,Affordable Card Reader with great performance
LG Headset 2.4GHz,Premium Tech Distributors,50.37,EUR,SKU-5093-PRO,Affordable Headset with great performance
ASUS Micro USB Cable USB-C,Smart Supply Chain,238.82,USD,ITEM-8411-B,Latest model Micro USB Cable with warranty
ASUS Steering Wheel Elite,Asia Imports Ltd,86.80,USD,PROD-8169-PRO,Reliable Steering Wheel for business and home
Generic Gaming Monitor Standard,TechPro Supplies,149.00,EUR,PROD-2004-X,Latest model Gaming Monitor with warranty
Samsung Ethernet Cable Basic,Office Essentials Inc,103.35,USD,CAT-1821,Reliable Ethernet Cable for business and home
Samsung Wi-Fi Extender Elite,Wholesale Tech,218.26,EUR,CAT-8486-B,Latest model Wi-Fi Extender with warranty
Desk Standard,Mega Electronics,88.45,USD,PROD-9226,Premium Desk with advanced features
ASUS 4K Monitor RGB,Mega Electronics,232.88,USD,SKU-3830-B,Professional-grade 4K Monitor
LG Gaming Mouse Standard,Direct Import Co,32.00,EUR,PROD-3085-PRO,
Logitech Wi-Fi Extender USB-C,Digital Solutions,21.22,USD,PROD-7942,Latest model Wi-Fi Extender with warranty
Gaming Keyboard Elite,Office Essentials Inc,155.90,USD,,Premium Gaming Keyboard with advanced features
LG USB-C Hub Wired,Asia Imports Ltd,204.76,USD,SKU-9839-B,Reliable USB-C Hub for business and home
Samsung Presentation Clicker USB-C,BulkBuy Electronics,143.81,USD,ITEM-4751,Professional-grade Presentation Clicker
Generic Gaming Monitor Standard,Digital Solutions,173.38,USD,PROD-9282-PRO,Latest model Gaming Monitor with warranty
Desk Lamp Premium,Global Electronics Co,18.11,USD,PROD-6266,
Acer Phone Charger Elite,Smart Supply Chain,114.00,EUR,CAT-9616,Latest model Phone Charger with warranty
Dell Portable SSD Wireless,Premium Tech Distributors,69.06,USD,PROD-5336-X,Latest model Portable SSD with warranty
Lenovo Office Chair RGB,Asia Imports Ltd,48.67,USD,ITEM-1383-B,Premium Office Chair with advanced features
Cable Management Basic,Wholesale Tech,203.64,USD,CAT-3046,Premium Cable Management with advanced features
OEM Graphics Tablet Wireless,TechPro Supplies,167.58,EUR,CAT-6979-A,
Logitech Pen Set 2.4GHz,Asia Imports Ltd,145.87,USD,SKU-8581-PRO,Premium Pen Set with advanced features
Logitech Network Switch Plus,Mega Electronics,246.05,EUR,SKU-4217-B,Latest model Network Switch with warranty
Lenovo Micro USB Cable Plus,BulkBuy Electronics,166.72,USD,SKU-1109-B,
HP Filing Cabinet USB-C,Premium Tech Distributors,107.38,USD,,Professional-grade Filing Cabinet
Microsoft NAS Drive,Direct Import Co,99.39,USD,SKU-5119-A,Latest model NAS Drive with warranty
ASUS Wireless Keyboard Wireless,Wholesale Tech,50.28,USD,SKU-3631-B,Professional-grade Wireless Keyboard
Numeric Keypad Standard,Direct Import Co,131.53,EUR,ITEM-1134-X,Affordable Numeric Keypad with great performance
Generic Monitor Riser Wired,Tech Warehouse,294.66,USD,,Professional-grade Monitor Riser
Dell Powerline Adapter Plus,Smart Supply Chain,287.47,USD,SKU-3608-PRO,Reliable Powerline Adapter for business and home
LG Modem,Mega Electronics,253.82,USD,PROD-4361-PRO,Premium Modem with advanced features
UPS Battery Backup Premium,Direct Import Co,245.71,USD,,Professional-grade UPS Battery Backup
Dell Powerline Adapter Premium,TechPro Supplies,191.21,EUR,CAT-3377-A,High-quality Powerline Adapter for professional use
ASUS Lightning Cable Plus,TechPro Supplies,25.97,USD,SKU-9131-A,
HP Earbuds Premium,Wholesale Tech,50.67,EUR,PROD-5622-B,Reliable Earbuds for business and home
Samsung Webcam Basic,Global Electronics Co,171.34,USD,ITEM-8450-A,
HP USB Flash Drive RGB,Premium Tech Distributors,164.53,EUR,,Premium USB Flash Drive with advanced features
Logitech HDMI to DisplayPort Plus,Asia Imports Ltd,192.64,EUR,,High-quality HDMI to DisplayPort for professional use
Wireless Mouse Bluetooth,Office Essentials Inc,71.69,USD,SKU-5946,
Logitech Gamepad Plus,Tech Warehouse,238.57,USD,SKU-9369-A,
HP Filing Cabinet Standard,Global Electronics Co,270.48,USD,ITEM-9106-B,Affordable Filing Cabinet with great performance
Dell Mechanical Keyboard Wired,Direct Import Co,102.61,USD,CAT-4647-X,Professional-grade Mechanical Keyboard
OEM 32-inch Monitor Wired,BulkBuy Electronics,198.94,USD,PROD-3827-A,Premium 32-inch Monitor with advanced features
OEM Desk Plus,Premium Tech Distributors,109.78,EUR,ITEM-4493-X,Professional-grade Desk
ASUS DisplayPort Cable Pro,Office Essentials Inc,91.41,USD,ITEM-8547-B,High-quality DisplayPort Cable for professional use
Generic Steering Wheel,Office Essentials Inc,166.92,EUR,ITEM-2698-X,Reliable Steering Wheel for business and home
OEM Mechanical Keyboard 2.4GHz,Tech Warehouse,250.83,EUR,ITEM-3995,High-quality Mechanical Keyboard for professional use
Generic Wireless Mouse Wireless,BulkBuy Electronics,148.20,USD,PROD-9839-A,Premium Wireless Mouse with advanced features
Microsoft Wi-Fi Router Bluetooth,Digital Solutions,281.44,USD,CAT-8710,Professional-grade Wi-Fi Router
Logitech Wi-Fi Extender Bluetooth,Mega Electronics,153.96,USD,ITEM-9983-X,Affordable Wi-Fi Extender with great performance
Lenovo 32-inch Monitor Wireless,Digital Solutions,169.71,USD,ITEM-7764-B,Affordable 32-inch Monitor with great performance
ASUS Ethernet Cable USB-C,Smart Supply Chain,13.23,USD,ITEM-7384-A,
ASUS Desk Organizer Bluetooth,Direct Import Co,208.91,USD,CAT-6044-PRO,Professional-grade Desk Organizer
ASUS HDMI Cable USB-C,Office Essentials Inc,52.99,USD,PROD-8274-X,Professional-grade HDMI Cable
Acer External HDD RGB,Premium Tech Distributors,49.82,USD,PROD-5079-X,Professional-grade External HDD
LG Whiteboard Bluetooth,Direct Import Co,148.43,USD,ITEM-3558-PRO,Reliable Whiteboard for business and home
Generic Portable Monitor,Tech Warehouse,58.86,USD,ITEM-3866-X,
Generic DisplayPort Cable Elite,Premium Tech Distributors,162.34,EUR,ITEM-3867-A,Latest model DisplayPort Cable with warranty
ASUS Powerline Adapter Basic,Global Electronics Co,288.94,USD,PROD-5207-A,Premium Powerline Adapter with advanced features
Samsung Pen Set 2.4GHz,Premium Tech Distributors,235.14,USD,PROD-6498-X,Affordable Pen Set with great performance
Samsung UPS Battery Backup Bluetooth,TechPro Supplies,190.57,USD,SKU-5937-B,Latest model UPS Battery Backup with warranty
Acer Whiteboard RGB,Digital Solutions,125.01,USD,SKU-7471-PRO,Latest model Whiteboard with warranty
Lenovo Drawing Pad Plus,TechPro Supplies,101.34,USD,SKU-7519-PRO,Latest model Drawing Pad with warranty
Acer Monitor Riser Bluetooth,Asia Imports Ltd,159.60,USD,PROD-1557-A,High-quality Monitor Riser for professional use
Microsoft Filing Cabinet Basic,Tech Warehouse,164.53,USD,CAT-5011-PRO,
Powerline Adapter Bluetooth,Premium Tech Distributors,147.74,EUR,ITEM-4800,Premium Powerline Adapter with advanced features
OEM USB-C Cable,Premium Tech Distributors,191.01,USD,,Reliable USB-C Cable for business and home
OEM UPS Battery Backup RGB,Smart Supply Chain,63.90,EUR,CAT-8425-PRO,Latest model UPS Battery Backup with warranty
LG External SSD RGB,Tech Warehouse,167.33,USD,SKU-2055-B,Premium External SSD with advanced features
HP Drawing Pad RGB,Tech Warehouse,66.40,EUR,,Professional-grade Drawing Pad
Samsung Surge Protector Pro,Digital Solutions,236.24,USD,PROD-1004-X,
Microsoft Powerline Adapter Wireless,Direct Import Co,141.66,USD,CAT-6836-PRO,Premium Powerline Adapter with advanced features
Microsoft Wireless Charger Premium,Office Essentials Inc,26.90,USD,PROD-8285-B,High-quality Wireless Charger for professional use
Dell Wireless Keyboard Pro,BulkBuy Electronics,184.93,USD,ITEM-3841,Professional-grade Wireless Keyboard
ASUS Steering Wheel,Digital Solutions,10.76,USD,PROD-3625,Latest model Steering Wheel with warranty
OEM Tablet Stand Plus,Global Electronics Co,73.81,USD,ITEM-2659,Premium Tablet Stand with advanced features
Microsoft Desk Organizer USB-C,Premium Tech Distributors,299.16,USD,CAT-9021-PRO,High-quality Desk Organizer for professional use
LG External HDD Basic,Office Essentials Inc,292.14,USD,CAT-6496-PRO,High-quality External HDD for professional use
HDMI to DisplayPort USB-C,Smart Supply Chain,218.22,USD,SKU-5877-A,Affordable HDMI to DisplayPort with great performance
HP USB Hub Wireless,Direct Import Co,271.79,USD,CAT-3970-B,Professional-grade USB Hub
ASUS Pen Set 2.4GHz,Tech Warehouse,145.26,EUR,CAT-5631-X,Affordable Pen Set with great performance
Generic HDMI to DisplayPort Premium,Tech Warehouse,211.16,USD,CAT-9061-A,
Samsung Laptop Charger,Digital Solutions,42.96,EUR,SKU-9717-A,Professional-grade Laptop Charger
24-inch Monitor Pro,Premium Tech Distributors,15.25,USD,PROD-7113-X,Reliable 24-inch Monitor for business and home
OEM Presentation Clicker Wireless,Wholesale Tech,44.08,USD,,
Samsung Drawing Pad Premium,BulkBuy Electronics,176.83,USD,ITEM-3197-X,
Desk Bluetooth,Office Essentials Inc,267.68,USD,SKU-3025-PRO,
Samsung Gaming Monitor Standard,Tech Warehouse,68.27,EUR,PROD-3519-PRO,High-quality Gaming Monitor for professional use
Microsoft Mesh Router,Tech Warehouse,22.60,EUR,ITEM-1321-PRO,Premium Mesh Router with advanced features
Generic Portable Monitor Elite,Office Essentials Inc,167.77,EUR,,Latest model Portable Monitor with warranty
Lenovo Pen Set USB-C,TechPro Supplies,296.59,USD,,Latest model Pen Set with warranty
HP Drawing Pad Wireless,Global Electronics Co,293.28,USD,CAT-7552-X,Professional-grade Drawing Pad
Samsung Wi-Fi Router Standard,Global Electronics Co,269.63,EUR,SKU-1450-A,Affordable Wi-Fi Router with great performance
HP Presentation Clicker Pro,Asia Imports Ltd,137.23,EUR,,Affordable Presentation Clicker with great performance
HP Notebook Wired,Direct Import Co,62.33,USD,SKU-9743-X,Professional-grade Notebook
Logitech Lightning Cable Bluetooth,TechPro Supplies,72.33,USD,PROD-5809-A,Latest model Lightning Cable with warranty
LG Ultrawide Monitor Elite,Smart Supply Chain,24.53,EUR,PROD-3409,Reliable Ultrawide Monitor for business and home
Microsoft Notebook Plus,BulkBuy Electronics,139.57,USD,ITEM-1697-A,High-quality Notebook for professional use
Logitech Gaming Mouse Elite,TechPro Supplies,235.74,USD,ITEM-5186-PRO,
ASUS 4K Monitor RGB,Office Essentials Inc,77.48,USD,SKU-1900,Latest model 4K Monitor with warranty
Acer Phone Stand Standard,Global Electronics Co,11.81,USD,CAT-4805-X,Professional-grade Phone Stand
Samsung Steering Wheel 2.4GHz,Premium Tech Distributors,219.96,USD,SKU-2456-PRO,Reliable Steering Wheel for business and home
Lenovo Drawing Pad Premium,Wholesale Tech,253.08,USD,PROD-7711,Premium Drawing Pad with advanced features
ASUS Joystick Bluetooth,BulkBuy Electronics,18.10,USD,CAT-7972-A,Premium Joystick with advanced features
HP Power Bank Bluetooth,BulkBuy Electronics,226.68,USD,PROD-1419-B,Latest model Power Bank with warranty
ASUS Network Switch Elite,Premium Tech Distributors,201.74,EUR,ITEM-8732-PRO,High-quality Network Switch for professional use
LG Power Strip Plus,Tech Warehouse,239.00,USD,SKU-7001-B,
ASUS Wi-Fi Extender Standard,Smart Supply Chain,61.06,USD,,Premium Wi-Fi Extender with advanced features
Network Card 2.4GHz,Digital Solutions,162.92,USD,SKU-2230,High-quality Network Card for professional use
Ethernet Cable Bluetooth,TechPro Supplies,31.24,EUR,CAT-9882-X,Professional-grade Ethernet Cable
Samsung Modem Wireless,Direct Import Co,48.43,EUR,SKU-1030-PRO,Affordable Modem with great performance
Lenovo Micro USB Cable USB-C,Wholesale Tech,270.83,USD,PROD-1957-PRO,Premium Micro USB Cable with advanced features
Logitech Graphics Tablet Premium,BulkBuy Electronics,242.84,USD,PROD-3890-X,
LG Cable Management Bluetooth,Smart Supply Chain,269.59,EUR,PROD-5162,Professional-grade Cable Management
Lenovo Pen Set Standard,Mega Electronics,266.90,USD,CAT-8097,Professional-grade Pen Set
OEM Trackball Mouse Basic,Premium Tech Distributors,163.02,EUR,CAT-8193-PRO,Professional-grade Trackball Mouse
Logitech Monitor Stand Standard,Global Electronics Co,242.40,EUR,PROD-9528-A,Professional-grade Monitor Stand
Network Card Wired,Mega Electronics,85.38,EUR,SKU-1677-X,
Lenovo Mesh Router USB-C,Direct Import Co,263.62,USD,CAT-5786-PRO,Affordable Mesh Router with great performance
Dell Wireless Charger Wired,Asia Imports Ltd,152.66,EUR,PROD-6781-PRO,
Samsung Ethernet Cable RGB,Smart Supply Chain,258.17,USD,PROD-9857-PRO,Reliable Ethernet Cable for business and home
LG SD Card Pro,Asia Imports Ltd,125.53,EUR,PROD-3763-PRO,Latest model SD Card with warranty
OEM Desk Organizer Premium,Asia Imports Ltd,110.07,EUR,SKU-6235,Professional-grade Desk Organizer
Dell Desk Plus,Tech Warehouse,165.61,USD,CAT-1046-PRO,
Whiteboard Standard,TechPro Supplies,260.21,USD,,
Dell USB-C Cable RGB,BulkBuy Electronics,122.73,USD,CAT-8288,Latest model USB-C Cable with warranty
HP Micro USB Cable Plus,Wholesale Tech,221.39,EUR,SKU-6324,Latest model Micro USB Cable with warranty
LG MicroSD Card 2.4GHz,BulkBuy Electronics,200.32,USD,CAT-4396-PRO,